{
  "event_id": "11111111-1111-4111-8111-111111111111",
  "event_type": "doc.extract.requested",
  "schema_version": 1,
  "occurred_at": "2026-09-28T10:00:00Z",
  "correlation_id": "33333333-3333-4333-8333-333333333333",
  "object_id": "22222222-2222-4222-8222-222222222222",
  "process_id": "33333333-3333-4333-8333-333333333333",
  "data": {
    "job_id": "44444444-4444-4444-8444-444444444444",
    "files": [
      {
        "file_id": "55555555-5555-4555-8555-555555555555",
        "stage": "PD",
        "discipline": "AR",
        "layout_keys": [
          "layouts/44444444-4444-4444-8444-444444444444.json"
        ]
      }
    ]
  }
}
